name,country,date,review_score,review_header,review_body
David Paul,GB,"Apr 9, 2023",5,There is nothing wrong with Hetzner,"There is nothing wrong with Hetzner, except maybe that they are charging high prices for every IPv4, although even that is understandable with the current situation. It adds up a lot to the cloud yearly cost. We normal users don't want to meet shady spammers and crypto bros on the same neighbourhood, so stay away and stop complaining because of being refused service."
Human not Bot,ID,"Updated Apr 11, 2023",1,account disabled after sent document id,"I'm from 3rb country, how i know this? because my country not on the list on this website company. my account have been deactivated after sending scan of my ID. I cannot login anymore to fix this issue so i just try to make other account, and yah it disabled again after sent document ID. After then I give up to register on this site. I realized that i just from 3rd country that maybe many of other people on my country use this service to do some illegal thing maybe so they just reject me again and again. Also, they say can accept paypal, but when I register i must use CC to finish the registration. even after i login (before sent document ID) there is only CC on the payment method. I dont know is my document ID will be delete or will always save by them, i regret to give them my data for nothing. So from my experience, if your account not on the list, I suggest think twice to join this site, but if you from EU or US maybe you will get easier to register"
Fear,ID,"Updated Apr 6, 2023",1,Hard to kyc for new cost,"I'm a new customer but never get approve for KYC, okay because i look sus so i can't getting verify? I pay the vps when i can get verif, so please let me use the product"
Osama,EG,"Apr 3, 2023",1,Worst company I've ever seen!,"Worst company I've ever seen! This company is a piece of joke from account creation to the crappy support, I highly recommend to stay away from this fraud company!"
Bodhi Facilities,IN,"Apr 1, 2023",1,The worst hosting company,"The worst hosting company. We have two websites, digitalaakashsir.in AND nileshbodhi.online. Both are hosted on Hetzner Online Finland but the server is always down. I have checked another site, saptarshibanerjea.com, which is hosted on Hetzner Online Germany and this site is always up and running. So when we pay the same rate why Finland servers are always down and we struggle to keep our sites up and running as we always get one error, ""This site can’t be reached. It took too long to respond."" Please provide good services just like you do for German hosted websites"
Flavio LCK,FR,"Mar 31, 2023",5,I recommend it!,"Hello, I strongly recommend this hosting company price and quality found nowhere in other competitors, and last generation hardware regarding Intel servers."
iF,SA,"Updated Apr 4, 2023",1,They do not respect the customer,"They closed my account after I opened within 12 hours I didn't get a chance to find out my account Number or ID to put them here, because I put different name on my account and the name is my website, So they noticed some suspicious information in my account, so I will expect at any moment to stop my services for a specific reason, this is a very strict policy that you stop my site as soon as I wrote the name of my site upon registration, it is necessary That there is a stage if I do not respond, so you have the right to stop the service. I have been seriously mistaken when I trusted them to leave my website without a backup copy and currently I do not have a copy and try to communicate with them, but there is no point where there is no one who holds them accountable for this. They did not allow me to make a backup copy of my site despite that, that is, a stupid policy, that they are wrong with what they do with their judgment on us. The Customer Data Analytics section is very stupid with their ruling on us, it is really a great loss to the company. The company must reconsider this stupid section as soon as possible. I will write about them in all review sites to show their reality, that I really are very annoyed with the loss of my data because of this stupid section and their stupid ruling. They do not respect the customer. ====================================== I did not use any account based on their response below that it is misleading and lying, and this company does not have its credibility"
Benedict,CA,"Mar 27, 2023",1,Terrible company attempted to buy a…,"Terrible company attempted to buy a server from them as I do not own a passport I asked what means of other verification I can attempt with them, 2 days later they closed me account and called me a scam? why because I don't own a PASSPORT the hells wrong with you....."
Jose Luis,CO,"Mar 24, 2023",1,They lied to me just to get a payment back.,"If I could give them -10 stars I would. I had a vps for almost a year. I never requested support, the day I did it was a waste of time. I was sick for a long time and I could not access my server to pay for it and my service was suspended (something reasonable), I write to them and ask if I pay I can recover my information from the server and they answer me that I pay first and then we ""resolve"" that issue. I make the payment and then they tell me that I can only recover my account, but not the information from the server No. DISHONEST. I have been with DigitalOcean for more than 5 years and I have never had a problem (they did not delete my 5 servers, they only suspended my service, I paid and recovered everything), I wanted to give Hetzner a chance, but unfortunately it was a mistake."
Marx Ranaweerage,LK,"Mar 18, 2023",5,Hetzner's customer support is excellent,"Hetzner's customer support is excellent, as they have highly knowledgeable staff working in support. I will remain loyal to them to help grow my business. Hetzner's server delivery time is impressively fast, and I always appreciate their services. I wish Hetzner all the best."
Sergi Garzon Orquin,ES,"Mar 17, 2023",5,Really good service,"Really good service. Any problem a quick call puts you on the phone with a tech guy in the center. Never had a problem before, just some questions about upgrading the servers Switched from 1&1 to them and saved some money and problems"
Thibeau Maerevoet,BE,"Mar 16, 2023",1,They keep making the same bs about a…,They keep making the same bs about a few connections to unrouted IPs. Totally unnecessary.
muhammed idlibi,TR,"Updated Mar 17, 2023",4,edited,"I was contacted by the account support department and the problem has now been resolved But I still think that some employees need more training In general, thank you"
Tobias,DE,"Mar 14, 2023",1,can't be trusted,"Made an account, gave them my credit card details including bank approval then my password wasn't accepted anymore. Called support, was told to write an email. Since then no response! At this point all they've done is grab my credit card details. I highly recommend staying away from that company!!!"
Adrian Lungu,IT,"Updated Mar 16, 2023",1,HORRIBLE. A NIGHTMARE SERVICE.,"Their prices are ok, but customer support is HORRIBLE. HORRIBLE. Not only their english is bad (how can a multi dollar company have people who don't really speak english?), in my case they are saying I had unpaid invoices when in my ""invoices"" menu all are always paid, they are all green. So they went ahead and deleted my website and my email server that i really fckn needed for work and now I have to deal with their incompetence. Cherry on top, I opened a ticket support, no answer, sent them a DM on instagram and they said they'd be looking into my case, AND NO ONE DID ANYTHING EVER. Stay as far away as you can from these german incompetents EDIT: don't give me ""please pay"" bullsht. Take a look at my account accounts . hetzner . com/invoice, it is all PAID. In german alles ist bezahlt. In what other language do I have to write that i paid everything, where are these mysteryous invoices that i haven't paid? Make them appear on the site and i'll gladly pay them if YOU FORGOT to publish them on my account. I asked to all warning emails WHERE are the invoices as they don't appear in my account, the reply? services closed. See this is exactly the kind of pathetic support they have. stay AWAY"
Kevin,BE,"Mar 14, 2023",1,I have been working with Hetzner for…many years,"I have been working with Hetzner for years now. They used to a bit more expensive than the competition but you got access to extremely versatile and competent technicians. You could mail them and they would reply quickly and often with very elegant and clever solutions. Unfortunately, over the last few years this has changed. Now they are just expensive, if you ask them for a small intervention, it can take days for them even to reply. Let alone actually do the intervention. If you call them the answer is always some variation on the same theme : ""Computer Says No"" After more than fifteen years I will slowly guide my customers towards other providers. I can think of no compelling reason to stay with Hetzner."
Andrej Tekel,SK,"Mar 14, 2023",1,This company is the biggest joke i ever…,"This company is the biggest joke i ever saw. First of all i asked them to cancel my server like 7 times for me and they obviously did not do it cause of prolonging subscription, like this is unreal behaviour. Than i manualy canceled it/ did not use server for 3 month get cancelation server confiemation mail and yet they sent another invoice today. I am gonna do my work and let this joke company behaviour to my lawyer to at least report them to beaureau, because this was an unreal experience. Please stay away of these people with support and business model of criminals."
Игорь Панасюк,UA,"Mar 10, 2023",1,I decided to try this hosting for the…,"I decided to try this hosting for the test, paid the bill for 55 euros for the first month. I issued a service for my Polish company. I entered all the details of my company in order to receive invoices later. Then I get a message that I have to send my passport. I sent my passport, and seeing that I have Ukrainian citizenship, they canceled my account. Even if you find my company on the Internet, it says that I am the owner and about my company on many services. But after they saw my passport, they simply deactivated my account. It's just a terrible attitude"
Sunset Daily,US,"Mar 10, 2023",1,This was some of the worst customer service I have ever had in my life…,"This was some of the worst customer service I have ever faced in my entire life. This company also uses parts of their fifteen minutes of fame holding the fact that they have servers in their control. They are rude people. They talk over you and then hang up when trying to talk to them and fyi, this is their business model. THREE (3) different people hung up on me and mind you, we are on speaker phone. There was never any profanity used. There was a day due to being in different countries. They did not like hearing a so called loud voice and the answer was to hang up three different times. They are not good people. They hate this work. Thats for sure. And, this is not even going into how the server goes down every 8 days. Thats the issue. Yet trying to get any help is pathetic. Its so bad. I would never call them again or deal with this company. I am ftp'ing out right now. This was a nightmare and all I did was go to sleep and wake up to a server not working and then I was hung up on three time because their little feelings got hurt. Meanwhile, my server is down and my account is locked because we could not get in to reset it but their feelings were so hurt because of a loud vocal that they hung up THREE TIMES rather than help. They actually talked about wanting to help. I kept saying instead of talking about wanting to help that they should just help but thats not a thing at hetzner. They would rather use part of their odd fifteen minutes of fame to use its power because they have control of your server. Its the exact thing to never do when being a host company. They are evil people. I am serious. They are downright evil to do this to people. You feel helpless and they know it. They take advantage of it. They use it. Like I said here, its part of their business model."
Manish,IN,"Mar 8, 2023",4,You Can Trust Hetzner For Production Server,"I've been using Hetzner for about two years and have never had an issue or outage. They conduct some maintenance from time to time, but it's always properly communicated and organized. Here are my likes and dislike. Pros: 1)Good Pricing for Cloud and Dedicated Server 2)Almost 99.99% Uptime 3)Scalability Option 4)Snapshot Option Cons: 1) Provide your personal ID and photo as part of the account verification process. 2) The setup costs and additional IPv4 costs are excessive. 3) Dedicated Server Setup Fees 4) Invoicing System - They never stated the due date, as in my instance, the invoice was raised on the fifth of each month, so I always paid that day or the next day. I haven't spoken to the support personnel in two years, so I can't speak to that. I have used there Cloud, Dedicated Server, Storage Box and Volume services. Overall, I can suggest using them."
Meelis H,FI,"Mar 5, 2023",4,I have had a longer time smaller VPS…,"I have had a longer time smaller VPS with hetzner and now another bigger. Despite of so much of negative reviews, I do not have much to complain, I think that price is really good, performance has been great, also excellent cloud ""console"" where you can scale your VPS up or down in seconds.. + more advanced cloud features when needed, ""Storage Box"" which gives you really cheap storage that can be attached to VPS's, networks speeds has been amazing.. only minus is their payment as you cannot pay upfront like for a year (as a company this is a bit hassle to make sure accountant gets that bill every month)"
Will,AU,"Mar 3, 2023",1,Does not shut fraud sites down,"I am a security consultant. I reported to Hetzner fraud and scam sites running on their platform; those sites were created by Russian scammers. I asked them to shut those sites down. Usually the response takes a lot of time and in the end those sites keep running using a different domain name but the same IP address. I explained to Hetzner it is very important to ban the site owner, but it did not happen. I believe we cannot reduce the amount of scam in the Internet, thanks to such companies like Hetzner."
Nenadd Chandorkar,IN,"Feb 25, 2023",5,We are working with Hetzner from last 1…,"We are working with Hetzner from last 1 year, the cost is cheap and service is good. We were able to shutdown our phyiscal datacenter and move all our projects to Hetzner. Working with Hetzner is cool."
Nagui Bihelek,CA,"Feb 24, 2023",1,Worst experience ever,"Worst experience ever. Horrible business practices. After trial period ended, the first payment with Paypal didn’t go through, and they cancelled our account and send us threatening email. I paid with seconds of receiving their email by logging into my account and paying the service invoice. Checked all was ok. But they had already started cancelation process, and later I found out that they deleted all our data even though we had paid for a full month on same day of notice. They showed no remorse or made any effort to rectify or compensate us, and despite being unable to access our data while we had paid in full, they did not refund the full amount and only partial refund."
Johan,NL,"Feb 16, 2023",5,Thanks for the good service Hetzner :),Numerous products/services with Hetzner and super happy with the whole experience so far!
Þórhallur Árnason,IS,"Feb 16, 2023",5,Don't understand the negative reviews,"Don't understand the negative reviews I just need to put it out there, I have been with Hetzner since 2018 (4 years at the time of writing this). They host a cloud server for me and I didn't have any downtime or problems with support or accounting + they have killer features."
Erkut Ozen,TR,"Feb 13, 2023",1,Their support is very bad and account is disabled.,"Their support is very bad. I just became a member and they deleted my account without approving it. I wanted to create a membership with the right information and get the service, but it was very good to see these aspects. I think they only serve German citizens and look suspiciously at all other country citizens. Although it is recommended on many forum sites, do not be fooled! There are much better providers. Be sure to check out the complaint threads on platforms like Reddit. Not good hetzner, not good. Sorry for this comment, but before treating new customers as suspicious, remember that they can become customers and organize your support system accordingly. This will be better for the future of the company."
Europa PL,GR,"Feb 11, 2023",1,Another Disaster from this company,Another Disaster from this company. for the past month plesk activation key stoped working and we had to move our data to another server provider. we have requested cancellation. 4 weeks we tried hard for solution. Everyday emails to support and still they try to solve the issue. the funny about this is we have paid in advance for all services.
Pezhman,TR,"Feb 10, 2023",1,deleted my account without acceptable reason,"They just deleted my account right after registration and uploading my proof without any acceptable reason. Please be aware simply this can happen for you too. Dont waste your time to registering and go for better company. This is what they emailed me : After reviewing your updated customer information, we have decided to deactivate your account because of some concerns we have regarding this information. Therefore, we have cancelled all your existing products and orders with us."
markus,CH,"Feb 9, 2023",1,I had a terrible experience with…,"I had a terrible experience with Hetzner when trying to open an account for web hosting. During the account creation process, I was informed that there were ""inconsistencies"" in my information and my account was not approved. To make matters worse, my email inquiries about the issue were ignored and the customer service ended the live chat without resolving the issue. I felt discriminated against and mistreated by the company. Based on my experience, I cannot recommend Hetzner to anyone."
Nika Dateshidze,GE,"Jan 31, 2023",1,Terrible company with a terrible support,"As a programmer, I have worked with many services, but ""hetzner"" is the worst one I have come across, we have a tourist site and at the height of the tourist season, the server is turned off without warning, the support does not answer, does not explain the reason. do not even give the opportunity to pick up your files and database. several months of work is simply lost, as well as customers canceled orders. ""hetzner"" themselves are the worst of the worst,"
McMelon Tube,SK,"Jan 28, 2023",5,Great,Everything is just great. Never had any issues with them. Would 100% recommend and use again
Angry,CH,"Updated Jan 21, 2023",1,Terrible company with a terrible support,I've been trying to delete my account for multiple months. Meanwhile I'm getting billed for a product I haven't used in a long time and the support team even has the audacity to be insulting. Haven't found a single support member who was willing to help or even be friendly and that despite multiple mails as well as multiple calls. I cannot believe that this scammy company is legal.
Alex,RU,"Jan 16, 2023",1,Once you get DDOS,"Once you get DDOS - you can change this ""server"" to something more reliable, with 24/7 support, because this ""hosting provider company"" (if it can be called so) gives such amazing servers which will go down after 5 IPs which doing parsing."
Leonor Pina,MX,"Jan 5, 2023",5,excellent service I recommend it,
Omor Sarif,TR,"Dec 16, 2022",1,Scam Company,"I've had nothing but negative experiences with this company. Their cloud dashboard isn't secure at all or they're running a scam company. They created a total of 5 servers without my permission and when asked the reason, they said it was because my password was compromised. Except it was 2 factor authentication. Despite this, they issued invoices and attempted to charge my cards despite contacting them. Totally a scam company and don't get fooled by affliates who are getting paid to promote these clowns garbage products. Not to mention that the servers are slow, sluggish and will be painful to deal with. I'd never touch these clowns' server and will never recommend to any of my clients."
KSR,FI,"Updated Dec 19, 2022",1,Useless,"Useless. The service was promised to work within minutes, but 3 hours later there is still nothing visible of my order on my account. It makes no sense for an online storage service to not be useable instantly. Update: The next day I received an email saying my account has been closed because of ""concerns"" with ""my updated customer information"". This, after I had provided my credit card info to them and my order had been accepted. I never did any ""updates"" to my information. And now they are trying to request more personal information about me from this review here too. I had to contact my bank to block them from being able to charge my credit card. Avoid this company!"
dennis,GB,"Updated May 5, 2023",1,no ddos protection and overheating,"no ddos protection constant liers, they dont let their servers boost clock and they overheat 24/7 if under load EDIT FROM HETZNER’s reply: no, you don’t have any protection, stop misleading your customers. i got my friends to test the most basic of ddoses, and you couldn’t handle it."
Юра Васько,UA,"Dec 14, 2022",1,Negative expirience with Hetzner,"Hetzner is definitely not a customer-oriented company. Communication with the Hetzner support team is just awful - the average response time for mail is 2 days. Also, the identity verification process is not clear. Hetzner just deactivates my newly created account without any explanation. I do not understand how is it possible to run a business in this way. Do not recommend this company."
Alireza,AE,"Updated Dec 30, 2022",4,"Awful verification system, Great Service","I've used Hetzner for hosting before however right now the Idenify system rejects my ID and passport even with 20 tries, I hate this, is this not enough of a confirmation for you? Update: after some emails I get to confirm the account but I stand by my word, the Idenify system is one of the worst passport verification services to ever exit, Hetzner you should try to confirm the identity based on OTP, Mail or paypal verification."
Walkaisa,DE,"Dec 13, 2022",5,BEST PRICE / VALUE,"The best VPS provider I have had so far. I have tried very many. From low budget to high budget. But the very best is Hetzner. The dashboard is unique, simple and very clear. The server runs top! No downtimes or similar so far. The internet speed is incredible. Up- and Download up to 15 GBp/s. (Location: Ashburn, USA). I haven't had any experience with the customer support yet, so my rating is only based on the server performance."
Guacanagarix,DO,"Dec 7, 2022",5,A good economic VPS,"A good economic VPS, perhaps for slightly advanced users"
Tanzil Hussian,PK,"Dec 4, 2022",1,Totally scam company don't waste your…,"Totally scam company don't waste your money and time. I am using cloudflare load balancer with hetzner server where they detecting it as network scan and blocked my servers. I explained multiple time, given them my servers credentials for Audit that there is no malware software except cloudflare load balancer but they didn't accepted."
Trentos,RU,"Dec 2, 2022",1,Scam platform that steals precious…,"Scam platform that steals precious time. We needed servers, I registered here, passed verification, added a card, I sit working with servers for a couple of days and then I was banned without explanation. Then the same story with a friend's account. And six months later, again with me, only this time they took 541 dollars from me and promise to return them within 7 days, but not 541, but 530."
sanad nabil,EG,"Dec 2, 2022",1,Don't waste your time with hetzner They don't have a support team,"i'm trying to create account and activate it but its a mass for them completely garbage automated verification system and i think their support team doesn't exist worst support you will ever had i uploaded my id But verification step Faild i tried too many times to email thier support team but there is no response AT ALL. I even uploaded my id pictures and Emailed thier team with all Info they asked for and more. i told them to pay in advance before i can use any server but no response at all total waste of time i was moveing from contabo to hetzener after 3 years so i'm happy to pay DONT WASTE YOUR TIME GO TO OTHER HOSTING COMPANIES THAT RESPECT THIER CLIENTS They don't have a support Team Don't respect thier customers Total Waste of your time Dear Mr Sanad Nabil After reviewing your updated customer information, we have decided to deactivate your account because of some concerns we have regarding this information. Therefore, we have cancelled all your existing products and orders with us. Best regards Your Hetzner Online Team"
Willem,NL,"Nov 29, 2022",5,Prefect for personal VPS,Have had my VPS running with them for 3 years. Never noticed any downtime. Billing was never a problem. Never needed to interact with customer support.
