name,country,date,review_score,review_header,review_body
Bohdan Khomutskyi,CZ,A day ago,5,"Price-performance is great, very satisfied customer for 7 years. I trust this provider with my data.","I have been using different Hetzner services since 2017: dedicated server, back then unmanaged VPS, then cloud VMs, storage share, storage box and web hosting for my personal projects. I am very satisfied with the service, and especially performance to price ratio, and was surprised to see so snappy disks on web hosting. I'm getting very good performance for the money, and the company is solid - located in Germany, ISO27001 certified, I'm not worried about putting data on their servers. I do highly recommend Hetzner to anyone looking for affordable services with good price to performance."
einfachToe,DE,2 days ago,5,Wow!,My Experience was made great by a very lucky soul in the support-team. 5 Kudos
Tin Nguyen,VN,3 days ago,1,Definitely 1 star - worst service i have ever tried,"I was searching for cheap kubernetes cluster for my apps, then I found a git repo with simple setup guide, it had an affiliate link to Hetzner. Pricing looks very good so I try to signup for an account. I gave them my real payment info in signup process. After over a day, they sent me an email said that ""we have decided to deactivate your account because of some concerns"". What the actual f***? For real? They just cancelled that without giving me a chance to verify. I then sent them an email asking for why, and they said like ""we don't share details, we don't want you"". Again, no option to send ID or passport or whatsoever. But they already have my payment information. Later I saw a small transaction on my card that I did not authorize or know about. I then had to lock my card. I demand them to delete my payment info out of their system permanently, but still did not receive a response. For me, this looks like a scam. Why ask payment first, before verifying an account? At very least, they should ask for ID or passport first before start collecting sensitive information, right? As the title, Hetzner is the worst cloud service i have ever tried. But lucky me, after the rejection, I found a better provider with both spot and on demand pools, which is a perfect solution for me. And more important, it's much cheaper. Ha ha, thanks God."
Quora Forum,PK,4 days ago,5,I am a happy hetzner customer,I am a happy hetzner customer. They have some state of the art servers and hosting for every need and at very affordable cost. Best part is that there vps come with option of backup and a separate snapshot which is very helpful in our case. They have a very excellent hourly billing system. change server requirement any time and you will be asked to pay for only required amount. There server are very fast and now our website is getting consistent high traffic without any down experience.
Дмитрий,CY,5 days ago,5,My account was stolen as a result of my…,My account was stolen as a result of my password being leaked. The Hetzner team quickly helped me regain control of my account.
Manwil Zaki,EG,5 days ago,5,Highly recommended,"Great company, Great Support, Excellent Servers that are actually cheap"
Matt,CA,Updated 5 days ago,1,Hetzner is abusing your trust.,"Don't trust Hetzner..... These internet scammers always come up with reasons for their systematic thefts and are not accountable to anyone. We had said several times that we didn't want to use this hetzner service and had deleted all the files. They had blocked our access so we could not cancel the service so they could easily steal money from our bank. Even though our service was stopped on August 21st and we notified them by email, they still withdrew money from our bank account for September!! And the response to this theft is not systematic. First, every month the money was withdrawn automatically for that month. Why did they withdraw money again for September?!!"
D NV,GB,"Sep 5, 2025",1,Hetzner customer service 0/5,Hetzner customer service 0/5 Website down and no reply from their customer service!
Vrytek,IM,"Sep 2, 2025",5,Number One - Hetzner,"There is no Hosting/Data centre company that gives us so much satisfaction. Unmatched Cloud UI, nothing comes close. Auction dedis are so tempting cause they are priced well and don't get even get me started on the AX52 and AX102. Need to add 64GB RAM for a client? Took 30 minutes on a Saturday night 2:00 AM UTC. None better and hope they don't sell to Microsoft or some damn american company. Prost!"
Vaggelis Tsagklis,GR,"Aug 30, 2025",5,Hetzner is my best hosting experience ever,"Hetzner is my best hosting experience ever. I am developer and I need just security, performance, usability. I use Hetzner panel for more than 10 years for VPS, Dedicated and Storage absolutely not any problem."
Omar Eldessouki,SA,"Aug 29, 2025",5,Hetzner is the best DC for small/medium…,Hetzner is the best DC for small/medium business
ozan Bayindir,DE,"Aug 29, 2025",5,Excellent service,I am happy to transfer my projects through Hetzner. High quality and excellent communication are always guaranteed.
Vitali,HR,"Aug 27, 2025",1,They are fricking weird,"They are fricking weird. No more. I registered account, added a payment method and they are asking for a passport. They even don't allow to delete my payment information. They act more like a scam! They took my payment information and won't let me delete it: ```Manage payment details: You can only edit your payment information after we have verified your account.```"
Z Kowlesar,ZA,"Aug 26, 2025",5,Approach,"It's the service high level, the flexibility, willingness to help and the clarity of documentation. I guess it's the overall experience. There will always be issues but the way in which these are approached is what changes my relationship with Hetzner. Thank you!"
Maksym Popov,DE,"Aug 26, 2025",5,Wonderful DC,"I have been working with Hetzner for a long time. Their auction servers are inexpensive. I really like their high-quality and prompt support. Recently there was a problem with the server hardware, but they quickly replaced it with an identical one with the transfer of disk arrays. The hypervisor worked as before. Previously, I had dealt with other data centers, but in the end I completely switched to Hetzner. One thing was disappointing - this year, servers with a hardware raid controller disappeared at auction (."
CUN,CW,"Aug 25, 2025",5,Support is always swift and accurate.,
Kahoro Tech,KE,"Aug 23, 2025",1,"ID to verify, no account…",They asked for IDs and alot of information only for them to cancel my account immediatly. Its either they are collecting our Data or they are incompetent
Wojciech,PL,"Aug 23, 2025",1,My account got removed,"I created my account, gone through the whole confirmation process, and my account was removed because i allegedly provided wrong information, I did not even had an option to get to know what information I provided was incorrect, never had any similar issues with any other hosting providers."
Sinan,TR,"Updated Aug 20, 2025",1,They just block anyone outside of…,They just block anyone outside of Germany I suppose. I created an account and they just rejected my account without asking anything.
Trinity Rocha,BR,"Aug 20, 2025",5,Excellent data center,"Excellent data center, I'm very satisfied. One suggestion is to include a live chat to communicate with the team, such as through Telegram and WhatsApp."
Robert Casstevens,US,"Aug 19, 2025",1,Avoid,"Nah, bad experiences all around."
Ruslan B,ES,"Aug 19, 2025",1,Account with 6 purchased VPS was DELETED!,"I used Hetzner for about 1 month, and today they sent me a letter that they are blocking my account without explaining the reasons. I am SHOCKED! When I try to log in to my account, they write that the account does not exist. And there were 6 servers purchased!"
Nab,FR,"Aug 19, 2025",5,Excellent !!,"Quick support, excellent price. The best cloud provider for me."
Ethan Moore,AU,"Aug 19, 2025",1,"Incompetent, Anti-Customer Onboarding That Wastes Your Time","I'm based in Australia. I signed up with my real information, submitted my driver's licence, waited three full days for their so-called verification process, and was still rejected without explanation. All I received was a generic email claiming my account was ""suspicious"" with no clarification. No reason. No appeal. No opportunity to correct anything. Just permanently blacklisted for something they refuse to disclose. This is not security. It's not fraud prevention. It's a lazy, opaque system that penalizes legitimate users without any accountability. If their internal processes are so fragile that they can’t distinguish between fraud and a verified customer providing government ID, then their system is broken by design. Their support does not engage. You get copy-paste responses and are treated like a liability, not a customer. There is no recourse. No transparency. Nothing. If you're outside the EU or using Hetzner for the first time, understand this risk. You could follow every rule, provide everything they ask for, and still get instantly shut out. You will get no help, no clarity, and no second chance. This was a complete waste of time and one of the worst customer experiences I’ve had with any provider. Stay far away."
Malthe,DK,"Aug 18, 2025",5,Helpful & fast support,"Helpful & fast support, really like their storage boxes. Only downside is DDoS protection, but there are so many 3rd party providers of that in 2025, so that is not a problem."
Kol,GR,"Aug 18, 2025",5,"0 downtime, 0 lag, better DDoS protection than OVH","Even though they don't advertise a DDoS protection, my game server was able to handle huge attacks a lot better than OVH which is advertised as DDoS protected. Furthermore I had 0 downtime and 0 lag with them. Their server hardware also is top notch for the price they offer. Fully satisfied with them."
Fabin cole,US,"Aug 16, 2025",1,"Curse this hosting. Don’t even think of signing up, even by mistake.","If there’s a worst hosting company in the world, it’s Hetzner. If I had the option, I wouldn’t even give them one star—I’d throw a shoe instead. This is the only hosting company on earth that asks you for a passport just for verification. I’ve used SiteGround, A2 Hosting, Hostinger—never had this nonsense. Tried Hetzner once on a client’s request, and it was a complete disaster. First, their so-called “verification” took more than 18 hours, and then they straight up rejected it with a vague line: “due to some concerns.” Concerns? What concerns? Will your mother come and explain the concerns? I literally only entered the basic details—address, number, email—and they demanded a passport like some airport immigration officer. Even worse, there wasn’t any reason at all for rejection, but they still did it. To top it off, my client (who actually lives in Germany) also tried—guess what? Same rejection after 24 hours. Absolute garbage system. Pathetic. A disgrace of a hosting provider."
Comercio Local,BR,"Updated Aug 26, 2025",1,Worst experience I've ever had! Terrible service and support. Not recommended.,"I contracted Hetzner's services through an affiliate link, expecting to receive a $20 credit. However, to my surprise, the company decided not to grant the credit and stated that I would have to pay the full amount. I find this unacceptable, as I was merely testing their services to evaluate whether it was worth hiring a more robust server. I opened a technical support ticket to resolve the issue, but I was informed that nothing could be done and that payment was mandatory. As a result, I removed all my websites from Hetzner and deleted the server I had contracted. I do not recommend Hetzner and do not intend to use their services again. Additionally, the average download speed on their servers was around 300 kbps, rarely exceeding 5 MB/s, which I found unsatisfactory. The company still has much to improve. Don't waste your time. Upadate: This company is fraudulent, and I have reported them to my credit card issuer to avoid any unauthorized charges. Despite canceling the service, they continue to send numerous messages demanding payment. I strongly advise against doing business with this company under any circumstances. They persistently attempt to charge you for services you did not receive, treating it as if it’s completely normal."
joab,BR,"Aug 14, 2025",5,Very good service,"I'm really enjoying using the services I had problems with my machine that was infected and made SSH attacks, but the support was very good and the unlocking was very fast."
Ahmed Raad,IQ,"Aug 14, 2025",1,Hetzner disabled my account and…,"Hetzner disabled my account and cancelled my server over a $13.87 invoice I already paid, locking me out completely — no server, no invoice access, no support dashboard. Worse, their only “solution” was to force a bank transfer — no card, PayPal, or retry option. What kind of hosting company does this in 2025? I replied to their email pointing out their mistake and demanding access, but they never responded. You don’t shut down a customer’s account without a proper dispute process or even a reply. This is unacceptable and unprofessional. Avoid Hetzner at all costs — unreliable, outdated, and careless with customer data."
eddy,GB,"Updated Aug 18, 2025",1,"After 4 Years of Loyalty, Hetzner Locked Me Out and Threatened to Delete My Data","I have been with them since 2021. Decent and cheap web hosting. But until some changes in their payment system. Just because my monthly bill is too small, they have merged 3 months into 1 payment. It is not always easy to monitor when the 3 months has done a roundtrip (appreciate the reminders) and when I should expect an invoice. Once it's received, I don't even get a month to react and I get threats that dept collector agency will knock on my door and request the 6€ I owe them. And top of that, my services were blocked and my business got disrupted. The 3 months period and then 2 weeks to get it cleared is unbalanced, locking out and sending threats is shocking. Before coming here, I did emailed them to get to the bottom of this, but the staff who's name I believe is [removed]. was not interested to look at my complaint. Shocking. Not even apologized for disruption of my business. I am rating Hetzner with 2 stars just because they have competitive prices, but the customer care is horrible. If someone from Hetzner is reading this - Do not ask me to follow you up with more details or anything, instead ask your staff who dealt with me and then work it out. You weren't interested to solve my complaint, so now I'm not interested to update this review. Have a great day! Thanks Edit: Name removed, ticket id supplied, star rating updated from 2 to 1. Thanks for treating badly your customers and disrupting their businesses - Hetzner is not a reliable provider."
Ali Jafari,DE,"Aug 13, 2025",5,Outstanding Service and Support – Highly Recommended,"I have been using Hetzner for over three years now, and among all VPS providers I have tried, Hetzner has consistently delivered the best performance by far. Their services are extremely stable and reliable — I can confidently say that I have never experienced any downtime. What truly sets Hetzner apart is their exceptional support team. Every time I have contacted them, they have responded quickly, professionally, and with great respect. They have always been there for me whenever I needed assistance. Hetzner is, without a doubt, the best VPS provider I have ever worked with."
Bartek,PL,"Aug 13, 2025",3,I wanted to correct my details on my…,"I wanted to correct my details on my invoices, so I called the customer support number, and a rude person on the phone told me that ""two times I told you that we can't do that."" Which isn't true because correction notes for invoices are regular business practice, so I don't know why she was so rude. German support..."
David Bernal,ES,"Aug 11, 2025",5,The best team so far,The best team so far. This is the best hosting service you can find nowadays. I have been through many companies trying to find a good service and Hetzner is the one that I can recommend 100% at this moment. Support is quick and efficient always. Uptime is excelent and the tools in the client area the best I´ve seen.
Cristina,PT,"Aug 9, 2025",1,Awful,"I always do my best to recommend and choose EU-based service providers to work with. We are based in the EU and I want to support EU business. But companies like Hetzner are the reason that the US beats us in everything still. For background, we are a not-for-profit and need to have reliable service providers because we are accountable to our members. Believe me when I say the bad ratings you see here are real. I can’t speak for the quality of their servers because we never got to touch one. But, in all other fronts, Hetzner provides an inferior service. Their dashboard is so archaic and confusing that customers are forced to rely on outdated documentation. The alternative is an unreliable, arrogant support desk with limited office hours (ridiculous in 2025). To top it all off, the company engages in questionable tactics to get their invoices settled. We ended up paying this one single invoice but we didn’t even get to touch the server. In fact, we didn’t even complete the verification process of our domain. First, their support desk works only for limited office hours. And, by then, the whole experience was so negative that we felt very uneasy about transferring our not-for-profit to their servers. So, we gave up. Without completing the verification process, we had no access to the server, supposedly ready for us to use. But they still gave themselves the right to invoice us. It saddens me that EU businesses are still reliant on these primitive, dubious, unreliable service providers. We flushed €79 down the drain from our not-for-profit. That’s a hard one to justify. At least, we now found another EU-based host that has provided us with 24/7 support, a top-notch service and peace, so that we can focus on doing good, which is what we’re here for."
Nadir Belhadj,DZ,"Aug 9, 2025",1,"After 2 Years of Loyalty, Hetzner Locked Me Out and Threatened to Delete My Data","I’ve been a loyal Hetzner customer for over 2 years, paying hundreds of euros to host critical infrastructure for my business — including our email servers, ERP system, GitLab instance, and client-facing applications. Due to a temporary issue with my payment method, I missed one billing cycle — and that’s when everything changed. Instead of treating me like a valued client, Hetzner immediately locked my account, disabled access to all services, and sent me cold, automated messages demanding payment. I reached out multiple times asking the most basic question: ➡️ ""Is my data still safe?"" To this day, I never received a clear answer. They refused to confirm whether my servers or databases were still intact. Yet they continued pressuring me to pay — with vague, threatening messages that my data could be deleted. It felt like blackmail: “Pay first, then maybe we’ll see.” Imagine hosting your entire company’s infrastructure on a provider, only to be shut out completely — with no human explanation, no account access, and no assurance that years of data haven’t been erased. This isn’t just bad customer service. It’s reckless and unethical, especially from a company that knows how critical customer data is. For startups and small businesses, data is everything. 💬 My Message to Hetzner: If you truly care about your customers, especially long-term clients, treat people with respect. Automating service cancellations and refusing to provide clarity on data status while demanding payment is the opposite of professionalism. I’m now warning my clients and partners to avoid Hetzner unless you're ready to risk your data over one small billing delay. There are plenty of hosting providers who understand that business relationships are built on trust, transparency, and human support — not just servers and invoices."
Anoop Anand,IN,"Updated Aug 11, 2025",5,Satisfied Server Auction Customer,I've used several Server Auction machines with Hetzner over the years. Always had a good experience with their uptime and service.
Дмитрий,UA,"Aug 8, 2025",1,Disgusting service,Disgusting service. Found on the internet that it was cheap. Banned immediately after I created a profile.
Andrej K.,SI,"Aug 6, 2025",5,Very prompt reply and service from…,Very prompt reply and service from support personnel. Top-notch infrastructure for root servers; highly customizable and powerful tools available. Top-notch service.
Emilie Caroline Lydie Cubaud,FR,"Aug 5, 2025",1,Feels like discrimination against small developers or foreigners,"I tried to rent one server from Hetzner, not for big business or mining or anything strange, just for my small backend project. I wrote what I do, I explained everything clear and honest. Nothing illegal, nothing hidden. And then, they just delete my account. No question, no warning, no way to explain more. I was very surprised. I really don’t understand what I did wrong. I only wanted to test some scripts and automation for my app."
Colbol,US,"Aug 5, 2025",1,Obnoxiously Unforgiving/ Not client focused,"The service they offer is reliable, however I missed a single 0.64 cent payment because my card was compromised, and are now only allowing me to settle the debt with a direct wire transfer ($50 fee just to wire transfer). So a $50 fee to settle a $0.64 fee on a server I closed a month ago… locked my account so I couldn’t pay it on my own and deleted my server and all data."
N K,RU,"Aug 5, 2025",2,Hetzner pretends to care about its…,"Hetzner pretends to care about its customers, but as a matter of fact you should expect your account to be immediately permanently banned upon registration should you be located outside of EU. They seem to imply that you can contact them on Reddit or over e-mail with your info and that they will lift the restrictions. I had to send them my ID and proof of identity only for them to ignore both my e-mail and my Reddit messages. Upon asking my EU friend to register there, everything worked out in the end. For the issues I encountered using their services customer support was extremely lacking, shallow, and quite literally did not care about you in the slightest. Other than that, their servers work OK, and for their price, it's actually not that bad, but I would never keep anything serious on Hetzner."
Francesco Zimbolo,IT,"Aug 4, 2025",5,Outstanding Techincal Support for private clients,"Hetzner has some of the best technical support there is for private clients. We requested a KVM remote access to our dedicated server due to some internal technical issues. We could not see anything on the console. When we contacted hetzner technical support about it, not only they replaced the faulty KVM equipment (it confirmed it was an issue on their end), but they also found a faulty CPU fan and replaced that too without prompt from our end, and free of charge. Any time we had issues, they were able to provide swift and thorough support. Will recommend to anyone searching for a reliable, affordable and supportive server provider"
Gerrit,ID,"Aug 3, 2025",1,Watch out for these scammer…,"Watch out for these scammer Hetzner,tell you that they charge you 8 Euros for registration and 2,8 Euros a month for fee but when you cancel your Registration in 4 days because Hetzner takes too long to set up the server and security and you follow their 14 day refund policy they still want to charge 38 Dollars for 4 days use when you can buy a domain for 10USD.They charge 28 USD for a domain fee and 10 USD for set up fee. Be careful with the rat scammer German Company.Stay away from there scammers."
G.P. Grant,ES,"Jul 31, 2025",1,Customer for 15 years,"Customer for 15 years — total account lockout for one missed service We’ve been a loyal Hetzner customer for over 15 years, with dozens of active and fully paid domains and email services. But recently, due to a single missed renewal of a minor, unused service, our entire account was blocked. This included: • ❌ Suspension of all active and paid services • ❌ Inaccessibility of mission-critical email and domains • ❌ Complete lockout from the admin panel — we couldn’t even log in to manage or pay for anything There was no grace period, no escalated warnings, and no way to resolve it without full account suspension — a shocking policy for any serious infrastructure provider. Blocking access to essential, paid services due to one unrelated, unpaid item is an unacceptable practice. This approach puts businesses at unnecessary risk and shows a lack of consideration for long-term clients. We can no longer recommend Hetzner for professional use unless this rigid policy is changed."
Mikkel,DK,"Jul 31, 2025",1,"Requires ID, rejected without reason","I was simply trying to sign up in hopes of getting a cheap server setup, but they thought my details looked suspicious (I guess?) and thus asked for ID. I sent them my passport, and today I woke up and saw it had been rejected. Reason? Not stated. Action? Complete account suspension. If you don't want new customers, just say so on your website. This was a waste of time (And who asks for ID after signing up like this anyway? I find that really strange)"
Arash Abinama,IR,"Jul 30, 2025",5,Quick and to the point reply.,
