name,country,date,review_score,review_header,review_body
Adrian,RO,"Jun 29, 2024",4,They are a nice company but a bit too sensitive,"They are a nice company but a bit too sensitive in certain situations. Prices are fair in my opinion, services are reliable, performance is very good for the price. For average user with common needs, it will be perfect. Problem is that they are too sensitive regarding certain things, if you have a search engine and you crawl from a hetzner VPS, it will be terminated. If someone makes a complaint (legit or not) you will be asked to comply to random people's requests, if not, your servers will be terminated and you also risk for your contact details be shared with sketchy parties that initated the complaints. Just one example, on one of my sites I list domains (like a directory), no copyrigted text / titles or content; Random people come and ask me to delist ""their"" url without wanting to verify that they are indeed the owner (by file upload or meta tag) and Hetzner asks me to comply to these. Somehow understandable because nobody wants to spend time and resources mediating disputes, but it would be refreshing to see a web hosting company that allows freedom of speech (in legal limits) instead of avoiding any inconvenience at the expense of the clients. Sending client details to the people that initiate complaints is also not OK, unless it has a legal ground (court order, etc), because on one ocasion (similar to above situation) I had someone telling me that he will find me and ""finish"" me, unless I alter the content of my site based on his request. He had my contact details after he made an abusive DMCA claim without any grounds. The internet has become a nasty place and laws are only in place to protect corporations (DMCA, etc)."
- André Rodrigues,PT,"Jun 28, 2024",5,Hetzner dedicated servers are amazing,I've been using Hetzner dedicated servers for the past 2 years and had 0 issues so far. The prices and support are really good.
Andrea,IT,"Jun 28, 2024",1,refund setup denied,"Hetzner suddenly decided not to refund server setups canceled within 14 days, as per European regulations. Their lawyers don't care, they will answer in court for their actions"
Olaf Lederer,NL,"Jun 28, 2024",5,Fast and affordable VPS hosting provider!,"I created my first VPS at Hetzner in 2020 and I liked it so much that more have been added in the meantime. The servers are very fast and, above all, extremely affordable (compared to the competition). Contact with support is quick (you must send your message via the panel). Hetzner's services are so good that I only had two questions the entire time, and these were answered to my satisfaction. I recommend Hetzner to customers and partners and anyone looking for a good VPS provider."
chris davis,GB,"Jun 27, 2024",5,Great support great service could not…,Great support great service could not ask for a better partner for my servers
Julian,DE,"Updated Aug 14, 2024",5,Prices are not the best and very old…,"Prices are not the best (but ok) and very old HDD/SSD (I got many servers with a HDD/SSD lifetime above 6 years). But fast support and 99,9% uptime!"
pouria rastan,SE,"Jun 19, 2024",1,A company with inefficient and ridiculous rules!!!!,"I want to write something about the Hetzner company so that you understand how ridiculous this company is and how unplanned and ridiculous its decisions are. I created an account about a week ago, and upon logging into my account, it asked me to verify my identity, and I uploaded my ID card photo, and after 24 hours, my request was rejected for no reason!!!! . This time, I applied with another email with my wife's identification documents. I applied again, which was rejected again. I asked them for an explanation and I said them (Is our European passport not enough for you)? They replied that I should create a user account with an organizational email to be approved. I spent a lot of time and money and created a domain in Namevheap and then created an organizational email and this time I put 2 European passports for confirmation. Guess what happened? Was rejected ? And now this is how I know Hetzner, a ridiculous company with illogical, unplanned customer management, people full of motivation to annoy others and.... I am the manager of several Facebook groups of over 20,000 people in Scandinavia. I will share my bitter and ridiculous experience with the members of my groups and I will try my best not to let anyone buy any service from this company with this stupid behavior.I know that maybe one of them will come and give me an answer under my comment that (..Dear, we understand you and we are sorry for your bad experience, but we prefer not to state our reasons to avoid possible abuses) and this explanation They are the most absurd and ridiculous of all. They have not yet understood the world of communication"
André,PT,"Jun 18, 2024",1,Account Locked Without Clear Explanation,"I have been using Hetzner as my hosting provider, relying on their services for my projects. Recently, however, I encountered an issue that has made me question the transparency and customer support approach of the company. Without prior notice, Hetzner locked my account from making new orders following a routine check, citing unspecified red flags related to system policy violations, abuse complaints, IPs with bad reputations, and/or incorrect account data. They've informed me that I can continue to use my existing services but barred me from adding new ones for at least one month. After contacting support via the automated 'Robot' system, I was informed via email that my account had been blocked due to hosting three VPS for websites under development, which contained 404 errors and dummy data—common occurrences for sites in development. It's perplexing that developmental errors or issues are deemed problematic by Hetzner, especially since my site does not discuss these internally, nor are they relevant to the external operations. In an effort to resolve this issue proactively, I proposed to delete the server until the development is complete, demonstrating my willingness to cooperate and ensure compliance. This approach feels unnecessarily aggressive and non-collaborative, also the support team at email / phone are extremely agressive. I'm prepared to provide a full explanation of my project and submit any required documentation to clear up any misunderstandings. However, the support's approach, which I perceive as authoritarian, has made it difficult to engage in a constructive dialogue. Trust is crucial in business relationships, and I am committed to maintaining transparency and integrity in my dealings. I hope Hetzner will reciprocate this and offer a more cooperative resolution pathway. Accusing clients of scamming without substantive evidence also seems detrimental to your business's reputation."
gyuriX,SK,"Updated Jun 18, 2024",1,Too much traffic usage causes bans,"Hetzner blocks accounts with too much traffic usage. They offer unlimited traffic, but if you use too much of it, then they will ban you from using their services without even asking you to reduce your usage or telling you that they banned you because of that. This is a very bad business practice, and they should instead set clear limits, to avoid confusing people. Hetzner, please reply to this review with the actual traffic limit you have. What's the amount what won't get people banned let's say for auction servers bellow 40 EUR price? If someone wants to make a total of 1 PB outgoing traffic monthly, how many auction servers are needed for that to prevent getting banned? Reply to your reply: You ended your email with a sentence including this: ""this decision is final and cannot be appealed"". Why is that? Why can't you be more specific regarding what's the issue, so we could solve the issue instead of flat out scheduling account closure to end of July and guessing the issue was related to having too much outgoing traffic, after talking to your resellers. This makes no sense. They told me that 2 weeks ago you had a wave of bans, suspending a bunch of people for high traffic usage and now all those customers are coming to them and other providers."
Javad M,GB,"Updated Jun 13, 2024",1,they may block your acoount without notice:/,they closed my account without notice.i didnt abuse or didnt do anything harmfull with my servers. i lost all of my data that was very important to me the cloud is great and top quality but the way they treat people and there information is wrong as a customer i need to trust the service i use completely.your data's not safe here
CSG,CA,"Jun 11, 2024",5,An honest review after 20 years of using Hetzner,"I've been using Hetzner for around 20 years now and I feel like I have to give credit where credit is due. Regarding their dedicated servers line, I managed to satisfy all my clients needs with it. My company went from providing small IT services to full-fledged SaaS solutions. This success would haven't been possible without the reliability of their underlying infrastructure and the competitive pricing mode for its dedicated servers. I have also used other service providers over the years but none of them has come close to the quality/price ratio offered by Hetzner. I have also deployed some machines within their cloud offering, and I find it very competitive although I was expecting them to roll out more services following the AWS model. I'm currently in the process of testing their Terraform provider to convert part of my infrastructure to IaC. I will likely update this review once I have enough information to talk about it."
Ahmed Omar,KW,"Jun 11, 2024",1,They banned my account for suspicious…,They banned my account for suspicious when I ask the reason they say we don’t publish lol so bad
Ramon Rodriguez Alvarez,ES,"Jun 11, 2024",5,Everything just works,Everything just works. Simple and fast. And you pay only for what you really use.
A.A,PK,"Jun 10, 2024",5,Sheer Price-Performance Ratio - Privacy Friendly Cloud Provider,"Ok peeps, I'm a Hetzner Cloud user since February 2020 and I'm not shy of being a Hetzner fanboy. Is it wrong? Not if logic aligns with fanboyism. Why? 1. The benchmarks and lowendtalk posts speak for themselves. I've personally benchmarked majority of their CX and CPX lineups since 2020. I am never disappointed. 2. Heck their €3-€4 shared instances have a stable 1Gbps Down and Up. Plus, who on earth gives 20TB of FREE egress allowance? 3. Pure KVM virtualisation - nothing less. 4. They are strictly GDPR compliant. I'd rather deploy with them than AWS. I just wish they had S3 compatible Object Storage."
Alessandro,IT,"Jun 10, 2024",5,no one else is like Hetzner,"I have been using Hetzner services for over 15 years, I started with dedicated servers and then moved to the cloud, and I can say that no one else is like Hetzner: fantastic service, extraordinary value for money."
Vince,IT,"Jun 10, 2024",5,Highly recommended,"The keyword for hosting services is ""trustworthy"" and these people know their stuff. Their 24/7 tech support is amazing. Highly recommended."
Jojo,DE,"Jun 10, 2024",5,Used other Hosting Providers for a long…,"Used other Hosting Providers for a long time, always wanted to switch to Hetzner. I recently made the move, and well what can I say Its one of the Best for Dedicated Servers. Cheap and Great Performance. The Support is also awesome, fixed my Issues within one Hour. Anyone searching for a good hoster? Dont bother with other hosting providers, use Hetzner."
Sharukh Saifi,SA,"Updated Jun 18, 2024",1,They will block you minutes after you give them your ID and credit card.,"It's hazardous for anyone to work with this company, they can deactivate your account and delete everything without giving any explanation or chance to reverse the decision. They bait customers with suspiciously low prices so that they will try to register and get rejected without any reason. And when people talk about it online they will come and brag about their so-called fraud prevention thing. They are very arrogant. They do these things not only with new customers but also with the customer they have for years. This shows how incompetent this company is. When they didn't able to stop scammers from using their service they just decide to ban anyone with low value. EU always try to be a pro customer region they should do their thing and do something about companies like this. Since this company is violating privacy of people from around the world. Meanwhile, I will suggest people to use DigitalOcean. I am using it for years without any problem and they never asked for my ID. Edit after reply: Respectfully I don’t want to use your services even if you allow it. You guys are just running a racket to collect private information of your customers."
Janning Vygen,DE,"Jun 4, 2024",5,Hetzner!,"Hetzner is great! We are a costomer for 10 years. We run a very popular website and app with Millions of users and up to 100.000 request/s. Reasonable priced, top hardware, fast service. Hetzner rules! Can't say anything bad about it. Runinng a very popular website and App with millions of users and up to 100.000 req/s"
Albert Douglas,US,"May 29, 2024",1,I created an account on Hetzner and set…,"I created an account on Hetzner and set up two minimal servers for my Chat GPT Telegram bot. However, in less than 24 hours, I woke up to find that my account had been closed without any explanation. As a result, I had to switch to another service. This experience left me with only negative feelings."
Ahmed El-kattan,EG,"May 28, 2024",1,Yet another account deactivation...,"Another case of an account deactivation without any justification and marking it *FINAL*. It appears to be common practice for Hetzner to deactivate old and new account on a bizarre patters, which seems to be strangely targeting Arabs in my opinion, but they will always reply with ""No we don't..."". This started to be silly and unreliable, specially for a company that should be trusted for reliability, while I did not get the chance to test this personally, some users got their servers down! I will not wait for a reply arrogantly claiming that this is intentional for some unreasonable policy, especially after submitting my personal information for verification, the least I expect is a reasonable response."
ninja,MK,"May 24, 2024",5,3 years of positive experience,"I've been with Hetzner for almost 3 years, had 2 dedicated servers and a couple vps, and I couldn't be happier with the service. The servers are reliable, offering exceptional performance at a very competitive price. I almost never needed to contact support because everything worked well. The uptime was great, and the setup process was smooth. Highly recommended!"
Georg Hilgenberg,DE,"May 24, 2024",5,quick reaction and good hints for best…,quick reaction and good hints for best possible solutions.
B Barta,CZ,"Updated Oct 23, 2024",1,worst experience ever,"worst experience ever, they discriminate my country based customers reply: Really? First, you asked for a credit card. After I entered it and logged in, you then requested an ID. I am a citizen of the EU with valid documents, and after I sent them to you, you canceled my account without providing a reason. Is it normal for you to ask for people's credit cards and then cancel their accounts? We call this fraudulent behavior. Personally, I didn't even want your services; I am a long-time and satisfied user of Linode, but one of my clients asked me if I could help him with servers on Hetzner. So you know what? Keep your nonsense to yourself."
Alaa Ahmed,EG,"May 21, 2024",1,very bad company server got locked…,very bad company server got locked cause i`ve used windows remote desktop and and cost me 2 days to setup windows very complicated plus felt racist from their support cause im egyptian very bad exprince i did regret
Mounir,DE,"May 20, 2024",1,Account deactivated for no reason,"I signed up with Hetzner for a small project, but just one day later, they deactivated my account without explanation. They only had my ID and German address on file. This experience makes me question if it’s common for Hetzner to close accounts sporadically, or if they engage in some form of discriminatory selection during the account opening process."
Maks Poltoratsky,UA,"May 18, 2024",5,Best server experience we had,"Hetzner is our server provider for 5 years now. Recently we had our RAM and NVMe drives upgraded, and tech support did an excellent job in short time. We received fast and professional service for every task we required."
Christian Stangerup,DK,"May 17, 2024",5,Well-rounded performance and excellent value,"I've been with Hetzner for the past 4 years. Never had any serious issues, and the performance has been superb. They're also quick to answer support requests with straightforward resolutions - at least in my case. Truly a German powerhouse. Thank you Hetzner!"
anas khan,PK,"May 10, 2024",1,Lack of Support Response,"After creating an account, I was dismayed when it got rejected. I emailed support for clarification and offered verification, but it's been three weeks without any response. This lack of communication and delayed support is disappointing. Needs to improve their customer service."
mojtaba alipoor,DE,"May 8, 2024",1,How can they block my account for no…,"How can they block my account for no reason, which contains all the important information? I paid my invoice on the first day, and the customer should not be treated like this, I hope you will regret this. It is not really right"
nove dam,DE,"May 8, 2024",1,Closing old accounts,"Hello everyone I used to praise Hetzner a lot, but now I have no good memories of them They have closed my account after paying 200 euro invoice Without any reason Also, my friends messaged me that most of their accounts were also closed After a few months of use and invoice payment When you send them an email asking why it was banned and please return the account, they don't give any answer And without any warning, it will see your account and your servers will be disconnected, if you have important information in them, it will be very disastrous. I hope Hetzner cares more about his customers."
Mario Lawenstein,DE,"May 6, 2024",5,Excellent support from Hetzner!,"Many thanks to the great support team at Hetzner! They gave us fantastic support when we moved our domain and email accounts. Despite many enquiries, they always had an open ear and were on hand with help and advice. Thank you very much for your patience and expertise!"
logic guy,DK,"May 5, 2024",1,After giving them my credit card they…,"After giving them my credit card they wouldnt allow me to do anything on their site before verifying my passport or drivers licence, their interface for this however is broken and does not work on any of my installed browsers or on my phone, so as it looks i will be monitoring for false transactions and finding a different provider"
Adam Micheal Jonkers,NZ,"May 2, 2024",1,Hetzner rejected my company,I'm the owner of a business and a company in my country and just interested in Cloud and hosting stuff. We applied for our account while we talked to them before but they rejected us and when we asked for the reason they responded with no make sense answer. We asked to double-check our case but they ignored us multiple times and sounded like they blocked us anymore. I'm very wondering why they act like this when we ask for their ToC and we agreed on all Terms & Conditions.
George,DE,"Apr 30, 2024",5,Fast & Professional Service Delivery & Customer Service,"I became a customer @beginning of this year because my previous provider went belly up. I was impressed by the smooth and fast onboarding. It turned out that the reputation in the IT community was for a good reason. But even afterwards it is amazing how fast and committed they respond sucessfully to service requests. Mine might not have been to complicated and didn’t bring them out of their depth, but I had the impression I nevertheless got full attention. So far I can applaud Hetzner for its good performance and its customer service people! All @ a good price. Thanks for your service so far. Keep going!"
Abo Motaz,EG,"Apr 30, 2024",1,Trash racist compilated site do not use…,Trash racist compilated site do not use this site
Stefan Boh,NL,"Apr 29, 2024",5,Best company ever!,"I've been customer for some months now and i can't find anything wrong. Server, Connection, Control panel and Docs are Great. Everything works how it should, like the ip adresses and subnets (Finally some professionals). The support is amazing, really ... Never ever in my life i've encountered this great level of support anywhere. Unfortunately my server crashed having some trouble with the CPU and without any problems i got 3 choices what i wanted to do. I picked the choice for a new server with old drives for a fast resolution and without question i got a new even better server within 90 minutes and everything is working fine again, i did not have to do a thing! No DNS change nothing and no price change. Thanks again!"
Rudolf Zwicker,IT,"Apr 29, 2024",5,super performance and service,"Hetzner is currently running several of my company's servers. Today I also moved my homepage, everything worked perfectly. So far I'm extremely satisfied with the service from Hetzner - they're true Franconians."
Alex,LU,"Apr 29, 2024",5,Extremely helpful support,"Extremely helpful support. They escalated the call to personal service rather than insisting on following protocols to the letter, once it became clear that my support call was an edge case that fell outside of standard protocol."
Ipaomtk,IQ,"Apr 28, 2024",1,Do not use hetzner,"The badest hosting company on earth i have used for 4 months and paid all my invoices and simply the send me cancellation email that my account will be closed in 30 day and i have to move all my files to another hosting I have paid more than 2000$ just to setup my website file and now i have to move to another hosting and pay aging When I told hetzner support wy you will close my account the told me (Dear Client, Unfortunately we cannot provide you with any additional information regarding the cancellation of your account.) Ticket#2024042503005534 Do not use hetzner"
Efdal,NL,"Apr 26, 2024",5,Truly masterpiece of a cloud provider,"Using Hetzner for 2 years (dedicated server) and yes they earn a positive review for the reason that I've had a very good experience with them. I've had like only 1 outage in service that was coming from them, but were fixed in just like ~5-15 minutes. Completely managing my whole server my self, using Caddy (no hosting panel), Hetzner is the best cloud provider if you search for price/quality ratio. I have many applications being deployed, I secure them and program them efficiently and had never issues with any of my apps/services. I have status logs of a whole year with 99.6% uptime. A truly masterpiece of a cloud provider. Respect to those Germans for their amazing infrastructure and quality prices!"
Enmanuel Torras Mata,ES,"Apr 25, 2024",5,i try Hetzner for last three years,"i try Hetzner for last three years Personally, i thinks is the most better data center service i try in my 20 years in this market I love Hetzner, you too if you try"
Jimmy Lawrence,US,"Apr 24, 2024",5,Really nice hosting,"Really nice hosting, using it for 15 years, no issues at all. Extremely good support."
Jimmi Nielsen,DK,"Apr 19, 2024",1,I recently purchased a dedicated server…,"I recently purchased a dedicated server and have been experiencing ongoing issues with the Ubuntu installation. Despite multiple attempts to reach Hetzner's support team, the responses have been inconsistent and unhelpful. Initially, they insisted that the system should work as it functioned correctly in their test environment. Upon further contact, they acknowledged a problem with the boot sequence and advised me to attempt the installation again. After several attempts and no resolution, they claimed to have addressed the issue. However, when I followed up for a status update, I received no response for several days. When they finally did reply, they reverted to their original stance that there was no issue. This experience has been extremely frustrating. I have cancelled the server again; paid for a week and setup fee for a server that won't accept Ubuntu installation. Great job Hetzner..."
Thomas Batham,GB,"Apr 19, 2024",5,Simply blown away,"I have been using this provider for the last few years, From cloud VPS to dedicated. I got a server off one of the auctions and the experience the whole way has been phenomenal. I just had a drive failure, and support pointed it out to me when I was having issues, they were able to point out to me that my drive had failed and caused my recent issues and continued <1hour I had new drives and a working system... free of charge! I am going to be a long time customer!"
Alex,AT,"Apr 17, 2024",5,Super-happy with the customer support,"I'm a light, non-expert user of Hetzner hosting & email. And of course, I run into things that I can't solve myself – and *every time*, Hetzner' customer support was great+!"
brinkman it,NL,"Apr 16, 2024",5,"The famous ""German Pünktlichkeit""","For years I had my own dedicated servers and about 2 years ago started migrating to Hetzner. First a VPS, after that a few dedicated servers. So far, I'm very happy with the services offered by Hetzner. Upfront warnings of maintenance, quick and knowledgeable responses to tickets (only needed a few times). So, ""so far, so good"". The famous ""German Pünktlichkeit"" and very competitive prices for the great services they're offering."
