name,country,date,review_score,review_header,review_body
Yiğit,TR,"Updated Apr 30, 2021",5,Very good,"The Dedicated servers were excellent But... they're so strict about abuse emails, I don't like it. They wanted my site deleted for Spam emails. In short, although there are no copyright pages on the site (404), I'm dealing with copyright mail. The rest is great."
IMMA DED,IS,"Apr 27, 2021",5,Excellent Service,The Dedicated server's were excellent ! :)
Julie,FR,"Apr 27, 2021",5,Very good service,Very good service! Someone had posted information without permission and they took steps to have it deleted. Thanks Hetzner
Dejan Kletečki,SI,"Apr 27, 2021",5,Really good price and service.,
Mohsen Hosseini Rad,IR,"Apr 27, 2021",1,"""Hatzner Jogger!""","""Hatzner Jogger!"" I registered, I ordered a server, tomorrow was the invoice date, I paid, I ordered another server again, the invoice date changed me daily! I argued and said why did you change me and my company is not your joke! (It was a corporate account) Wrote to see if you cheated or not !? I also said that you did it unintentionally, you told me that you are a ridiculous scoundrel, ignorant, rude! And I stopped working with them! Tarzeh did not want to refund the cost of my first invoice Hatzner, you must know that I am complaining about you! I wanted to work with you! But your other backers change my invoice date one after another, and that's really ridiculous! I asked them why you change, he said to see if you are a scammer or not !? This is your work and what you are telling me, I am pursuing the scammer from the legal authorities! And the second thing is that you are bothering me, then I have to be in harmony with you? It's your job to play with my name and company! You made fun of me for 3 days and you do whatever you like! I also warned you several times in this ticket not to do these things, otherwise we will cut off my cooperation with you! There is no reason why every customer you register will see you as a scammer! This is rude to me! In the same way and the warnings that I gave, and I also told your previous supporter that they have called me several times with fraudulent words and I will stop cooperating with you. Also, when you give a cheap server, there is no reason to do whatever you want! When I have paid my first invoice, and I have given your SB69 servers to the customer, according to the invoice date, I give the customer time to pay, but when I see that you are playing a game and changing the invoice date day by day, I am questioned and all programs change and crash I am not your toy Refund the amount and you do not need to show me good faith! It was good faith to speak to me properly and not to harass me Not that you are telling me I am changing history to see if you are a scam or not !? The scammer will be revealed soon ... who I am or you who have been harassing me for 3 days now! Be sure to follow this work of yours."
The Modern Potato,US,"Apr 25, 2021",3,I've had a ok experience with this…,I've had a ok experience with this host. Their sign up process is tough and support barely helped. I submitted the correct info but they declined me many times. It turned out it was a issue with my email which is kind of stupid. The servers were pretty powerful and cheap compared to many other hosts so that's a positive.
vok ExTa,HU,"Apr 24, 2021",1,Everyone can change your email,Anyone can change your email without a confirmation!!! Dont give Hetzner your credit card data cuz its not safe!
ROn Whodar,SK,"Apr 22, 2021",1,Hosting fraud sites,
Ibantxu,ES,"Apr 22, 2021",5,After three years... would repeat,"After three years working with them, I don't change. I have tried with all those that appear in the first pages of the search engines and I always conclude that Hetzner is still the most complete offer in the current market. They have always covered all the specific and sustained needs over time. Dedicated servers, VPS, extra storage, the console and the robot to manage all services, speed with the delivery of servers, updates and replacement ... Always good! It would be nice to reduce the installation times in the Helsinki Datacenter, but they are clear reporting the times ... The datacenters in Germany are very fast in everything ... And the customer service, great! I do not know how many Spanish-speaking clients but it would be good attention in Spanish. If they continue down this path, I am sure that I will continue working with them for a long time."
Febryan Valdo,ID,"Apr 22, 2021",5,One of The Best Hosting Company,Great pricing and customer support...
⸻⸻⸻⸻⸻⸻⸻⸻⸻⸻⸻⸻⸻⸻⸻⸻⸻⸻⸻⸻⸻⸻⸻⸻⸻⸻⸻⸻⸻⸻,TR,"Apr 22, 2021",5,one of the best hostings,
Riekelt,DE,"Apr 21, 2021",5,Solid and reliable hosting,"I have been using Hetzner for a little over 5 months now to host a large set of micro-services and public-facing websites and it has overall been a pleasant experience. Their Cloud CP is very easy to use, and their latest addition of a firewall only makes setting up new infrastructure easier. As for dedicated servers, the CP does look a little bit outdated style-wise but it still does it's job very well and their server auction is a good place to pick up a cheap server to do some testing on. I have not experienced any major outages in the time I have been hosting with Hetzner, and whenever I needed support I could count on them replying usually within an hour."
Nuclerio / UuraniumM_PROD,FR,"Apr 19, 2021",1,Account disabled for no reason + 20€ Stolen,"Account disabled for no reason. I've paid 20€ to verify my account, 20€ that are supposed to be refunded, and 2h after, my account has been suspended. I opened 2 Tickets to have more informations, no response. I did not been refunded of my 20€. This is inadmissible."
Luko Jovanovic,RS,"Apr 18, 2021",1,erthrthtrh45tr,
Anton Egorov,RU,"Apr 18, 2021",5,A reliable IT partner,"A reliable IT partner, which constantly pleases with the best balance of price and quality."
Taha Zacholi,GB,"Updated Apr 17, 2021",1,I have had a server since last year and…,I have had a server since last year and every support ticket I tried to open or create has not been responded to. I've had to resolve all the problems my self and I've had enough of it. My server got blocked this month and I explained to them what it was. They haven't responded for 2 whole weeks. They've updated their price listing for the server I had and called them up. They said to open a ticket and this was in January. Yeah that support message still hasn't been looked at as Ive had no response from them since. EDIT: I forgot to mention their support is trash
Abir Ahmed,BD,"Updated Apr 17, 2021",5,You get what you pay BUT read the terms...,"I've been a Hetzner client for more than a year now. I have an EX-42 server with them and ordered an AX-41 yesterday. I have never faced any downtime on a server, their network is stable, hardware performance is up to the job and calling their technical department (DC) resolves issues very quickly. There are many reviews here that indicates payment related issue or server deletion. I would like to say that I'm one of those clients who pays very late. My invoice generates on 3rd of every month but I often pay them at 19th or 20th of that month. I receive multiple invoice emails and in the pdf it indicates the last day to pay as well. Terms and conditions are there for a reason, if we fail to follow the terms, it's only our fault ;) In my opinion, no server is stable for people who are running business without any Server expertise or have their own system administrator. Hiring an expert would change their mind once the server is configured correctly. The control panel is easy enough to navigate around. While I have to wait for KVM, it's understandable given the low price range. It doesn't take more than an hour for a KVM to be attached to the server once requested. But I do love the fact that I can just call the DC technician directly and communicate with them about any problems regarding my server. At the end of the day, no hosting company is perfect. But Hetzner does a very good job given the relatively low price range of their servers."
Sohail Ahmed,PK,"Apr 17, 2021",5,I have been using Hetzner for more than…,"I have been using Hetzner for more than a year by now, I'm so much satisfied and happy with their flawless services. I assure you their customer support is so much responsive and their service plans are very cheap and affordable."
Eduards,LV,"Updated May 3, 2021",1,Total ignorance - Hetzner deleted data without any notice!,"Hetzner deleted my data on the account without any warning for a failed SEPA direct debit payment which was supposed to be automatic. Such ignorance in dealing with customer data is unacceptable from a service provider providing business critical infrastructure. I DO NOT recommended choosing Hetzner for even a small startup not even a bigger company, if they can delete customer business without putting any effort in resolving a very basic issue. UPDATE: How Hetzner actually deleted the server: April 9, Friday, 19:45 - send an email to customer informing that the automatic payment has failed April 10, Saturday, 09:01 - lock the account April 12, Monday, 09:56 - delete the account and all stored data One warning, total ignorance. Very bad experience. If you have to, keep a surplus balance in your account, so that mistake like this (which Hetzner sales representative do not see as a mistake) do not happen to you."
Keivan Ghasemi,DE,"Apr 15, 2021",1,Hetzner never again!,CP is not user-friendly at all. You have to submit an application for everything because Hetzner is in Germany and German law is complicated. Web hosting is very slow. The support team is trying to make money.
Thug Bear,GE,"Apr 14, 2021",1,Not recomended,
шнюга бекба,RU,"Apr 14, 2021",1,Worst support,Worst support. If they locked up your nodes you will wait for response more then 1 week. And it is not a fact that you will get an answer
Halvnaken,SE,"Apr 12, 2021",3,Good prices and fast support - Bad ANTI-DDOS,"Good prices and fast support. However the anti-ddos was very poor which forced me to change provider. I was very happy with OVHClouds anti-ddos, if it was the same here; this would be the absolut best hosting provider out there."
Alexey,DE,"Apr 7, 2021",1,Bad technical support,"Terrible technical support. I received a letter stating that it was not possible to pay for the services of the hosting provider. I solved the problem with the bank and wrote to technical support, with a request to repeat the payment request, since my account was disabled and I could not log into it. But I was never answered and my account is still disabled"
Hà Hữu,VN,"Apr 4, 2021",1,Banned account for no reason,I'm from Vietnam after submit to register they delete my account for no reason...
Fredrik J.,SE,"Updated Apr 1, 2021",5,I've been using Hetzner on and off for…,"I've been using Hetzner on and off for the past few years and I've had nothing but a stellar experience with all their services, especially considering the price they charge for their services. Unlike providers like OVH, Hetzner actually gets back to you promptly when submitting tickets regarding eg. KVM access or replacement of defective hardware. Right now I got an AX41-NVME and the performance for the price is absolutely great for my personal use. I can see there is plenty of negative reviews here regarding the billing, but again most of the people have not read the term they agreed to when signing up for the service. Just stopping to pay a bill is not seen as a cancellation and I doubt they would do the same with eg. utility bills - if you pay on time there is nothing to be worried about at all and even if you want to cancel it is 1 click away within the Hetzner billing portal. I would recommend Hetzner to others for sure and I have absolutely no complaints regarding the service."
kunde,DK,"Mar 31, 2021",5,Many-year satisfied customer.,"I have used Hetzner for many, many years for dedicated servers, and recently also parts of their cloud services (VMs etc.). I am quite satisfied with their service level. I also work with competing cloud providers, so I know what level of service to expect, and Hetzner delivers quite good price / performance in most areas."
STEVE Mouris,GB,"Mar 30, 2021",4,I would be giving 5 if there were more…,"I would be giving 5 if there were more locations, guz its getting crowded with 2 data centres, other than that good experience, got same performance than other dedicated providers."
Johanna Dawson,GB,"Updated Mar 30, 2021",5,more location please maybe UK plant other than that brilliant,"used them for a year, cant fault them if you follow the correct requirement, doing KYC all that, and people who keep giving bad comments, must be anonymous people, i like their billing policy best by far, been monitoring the system and its gives same performance as t2 AWS so hetzner by far the best for me and cheaper."
Sumit Kumar,IN,"Mar 29, 2021",5,Best experience with hetzner.,Best experience with hetzner. I am using 3 dedicated server from this.
Julien Tinguely,CH,"Updated Mar 26, 2021",5,Great services,"Low prices, awesome and quick support, total availability."
naser ain,GB,"Mar 26, 2021",5,Access Tsing. Cheap fast can’t fault them,"They were one of the cheapest More data centres would be ideal other than that everything is going well, those with bad feedback are those who gives false info about them self/KYC"
Jaj Hahah,GB,"Mar 26, 2021",5,Don’t listen to bad comments,"Don’t listen to bad comments, using their dedicated for a year can’t fault them. But I’d love to see more data centre locations"
Evgenii Sokolov,SI,"Mar 24, 2021",2,3 disks replacements during one year…,"3 disks replacements during one year (each became faulty after some time), CPU Fan problem, that caused 30-min reboots and now our websites are not available. Yeah and 24/7 support is not answering by phone, I just listened music for 20 minutes and then nothing. And yeah, I wrote about reboot problems 2 times and on the 3 time when server became unreachable they decided to make some tests. Great service! Highly recommend!"
CryptoMancer,FR,"Mar 23, 2021",1,Don't buy your servers from Hetzner,"Imagine the fact that you are forced to use the account of one of your colleagues or friends to buy servers from this company just because of the color of your skin. Because they are offering lower prices, they think they have the right to treat people like animals. What a shame."
Leifur Steinn,IS,"Mar 23, 2021",4,Pricing on pppppoint,"Pricing on pppppoint! just lacks the Anti-DDoS, I've had over 20 bare-metal machines with Hetzner in the last year and a half and never had a single network or maintenance related downtime, the DDoS attacks were a problem, mitigation systems either weren't detecting anything or were seriously delayed."
krq,RU,"Updated Mar 22, 2021",1,After creating an account nothing stops…,"After creating an account nothing stops you from creating resources that you're gonna get billed for. Even if you just created an account to check the UI, see how everything works... If you create a volume and delete it a few seconds later or forget about it, they gonna send you a bill even if you didn't use the resources."
Erik Schepers,NL,"Mar 22, 2021",1,Abusive hosting,"Hosts nothing but frauds, website scrapers and other assorted internet scum. Avoid like the plague."
Максим Алексеевич,UA,"Mar 22, 2021",1,Support not responding,My account was blocked and I did not receive a response from technical support to resolve this issue
Bruno,PL,"Mar 20, 2021",5,"Very good and stable, but...","I am owning one VPS (CX11) and Dedicated Server from Outlet (SB28: i7-4770, 32GB RAM, 2x2TB softRAID1, Ubuntu 18.04LTS). VPS is working as HAProxy Balancer and Dedicated Server as Mail Server (Zimbra) Provisioning of both servers was pretty fast. I experienced one outage on Dedicated Server, but for unknown reason server hanged - not Hetzner fault. I am not sure why the Dedicated Server has problems with kernel updates. After upgrade to kernel 5.*, server stopped booting. I'm very satisfied with service."
Mihaly,AT,"Mar 19, 2021",5,Excellent service,"I have been a customer for more than a year and a half now. I'm yet to meet a single difficulty or problem using their services. I ordered, they delivered exactly what they promised and on time. I'm very satisfied with the prices too."
Hassan Hashemzadeh,US,"Mar 19, 2021",1,Hetzner dependent on America,"People hope, one day Hetzner become an company independent of US and perform itself rules not US."
Cos,RU,"Mar 18, 2021",5,Responsive services,"User friendly provider. Everything is on top! Good choice of options, fast support and technical responces. Fast services allocation. 100% compliance with declared. In time notifications on scheduled tasks and faults (extremely rare faults, by the way)!"
Gary Walker,GB,"Updated Mar 25, 2021",1,Poor response to fraud complaints.,"Receive multiple fraudulent emails per day from Hetzner customers, have tried contacting their abuse department but responses have been poor, no action is ever taken and you have to jump through hoops to even get a response. edit: Have sent the details to the abuse alias multiple times but all I receive are responses telling me it will not be looked it. Seriously your abuse department is the worst I've ever dealt it. At least one customer has been running an phishing site claiming to be a large well known auction site for at least a month. edit2: Today has been a good day, only fraudulent emails from 6 separate Hetzner customers. edit3: Hetzner abuse address has once again refused to deal with what is an obvious scam."
Blockchain Evangelist,DE,"Mar 17, 2021",1,DO NOT USE HETZNER! DO NOT USE HETZNER!,"So here is my story. I created my account a couple of days ago and setup vps for various services. After some days all my servers were not accessible anymore. Called Support and they said I was mining crypto, which I wasn't. I don't know if they understand what crypto mining is. Anyway, went on and ordered some dedicated server. Next day, all my servers were not accessible and my account disabled. Terrible experience. I guess cheap services come with a huge price tag in the end. I'd rather look for an expensive alternative. You can't be banning people without warning or notification. Not everybody is a criminal. And when I read similar reviews here I am mind buggled. I should have been here before."
Hendrik Demir,NL,"Updated Mar 15, 2021",5,One of the best hosting companies I've ever worked with,"I am shocked to see how many bad reviews this company has received in the past. I was recommended to take a look at Hetzner a week ago by one of my friends as I was looking for a good and affordable dedicated server. On a first glimpse, Hetzner's pricing looks amazing. They were one of the cheapest companies that one can find when comparing it to other providers, especially when you look at what you receive in return. They do charge a set-up fee which almost matches the monthly cost of your server, but that's fine. I also like that their prices don't change depending on how long you choose to work with them, someone that wants a server for a month pays the same monthly price as someone that wants a server for a year. At first I was a bit worried about their ""verification"" system, but it was fairly simple and quick. They have two options: one where you put 20 bucks on your account and one where you send them your documents. I first went with sending my documents, but since it was a manual process, I switched to putting 20 bucks on my account, as it is a bit faster. My account was immediately verified and I was able to order a server. Now, Hetzner has a page where you can find how long your order will take to finish. This was approximately 4 to 5 workdays when I ordered my server, but I already received it on Monday (ordered on Friday). To quickly summarize: I can genuinely recommend Hetzner to anyone looking for a reliable hosting provider with good pricing. They are fast, have amazing customer service (which is reachable from 6:30AM to 6:00PM) and have amazing prices. I have yet to experience the stability of their servers (for instance any downtime) and will update my review in a month. Also, I've learned a valuable lesson here: reviews regarding a hosting provider will never give you an actual ""score"" of the company. As you can see in the reviews, most are about the verification process of Hetzner which they created to prevent their servers from being used by bad people. You might have to wait a day or two to get verified, but what you get in return, is most certainly worth it. I hope to keep working with Hetzner and am grateful for what they've done for me so far."
Blue Softec,EG,"Mar 13, 2021",1,very bad support,I asked to change my server IP and hetzner team did it with extra fees but since this moment everything is down and I can't reach my server and hetzner team answered my support tickets that everything is works but it doesn't true I can't reach anything on my server and Hetzner team do not want to check this problem or do their work completely and want me to resolve this problem myself technically despite it is their work to make everything running again on the new IP
dr. sc. Mate Kosor,HR,"Mar 10, 2021",1,"Great for hobby, but not for critical business","They have great prices, give you extras (like storage for backup, private network, dns) and have decent admin panel. But if you hit their abuse triggers they will cut you off without explanations. They do not provide any explanation about what you did wrong. You have no grace period to get your data off their machines. They don't send you notice. Imagine you set up your web service, and after some time, suddenly customers start calling. You try to log in and there is no access. Upon email to their support you get few bare words and no explanations. You are left scrambling to set up your service again somewhere else. That happened to me. I hope they change their approach to customers. I understand that they can choose who to work with, but doing so in such an erradic manner will drive the legitimate business away. Right now they are not dependable."
OTG Zusiqs,NL,"Mar 10, 2021",4,great,great service but it did take kinda long to receive my server
Max V.,RU,"Mar 10, 2021",1,Comedy from Hetzner.,"Hahaha, this is an outright shame! See what Hetzner representatives answer to the reviews. They humiliate themselves with their answers.) And my review is also like many others. Yesterday I registered an account (I even sent a photo of my passport), started the server. I didn't even have time to do anything. I just downloaded the archive with the files and unpacked it. Didn't do anything else at all. And today I see that my account is disabled. They went crazy there. They apparently have a persecution mania, they think that everyone wants to deceive them :)"
Jitendra Dadhaniya,IN,"Mar 9, 2021",5,Good Company To Deal with,
Sergey,RU,"Mar 8, 2021",1,Read reviews before using Hetznzer!,"Oh, what a pity that I did not read the reviews before using Hetznzer. Yesterday was a non-working day (Sunday, day off). But I spent all day getting the server up and running, figuring out how it works and setting everything up. I went to bed in a good mood. But when I woke up in the morning, I was upset. I see that my server is not available and I cannot log into my account. The last opportunity to find out what is the reason is to write to technical support via mail. I wrote, but there is no answer. Now I see that there are a lot of people with this problem. Therefore, I regret that yesterday I wasted my day off on this terrible hosting, and today, on a holiday (in Russia today is a holiday not a working day), I will spend one more day to go to another hosting. I urge everyone to think three times before using the Hetzner."
Miro,FI,"Updated Mar 8, 2021",5,Most reliable,"Most reliable, performant and affordable VPS hosting. Included free DDoS protection good too. Been using their VPS products for over a year, and I can't say I have any complaints. Very clean user friendly interface too."
George Tarlas,GR,"Mar 6, 2021",1,Low quality dc with low quality servers.,
Alin,RU,"Mar 5, 2021",1,They just blocked my account.,"They just blocked my account. There is no reason. I did not break the rules (I read the rules before starting the cloud server). No notifications or warnings came. I cannot create a ticket because the account is disabled. I wrote to them by mail, but there is no answer. My data is on the server, I can't even download it. Outright disrespect for the client."
Lam,LV,"Updated Mar 5, 2021",1,Hetzner have charged me for advance…,"Hetzner have charged me for advance while they have never stated that they can charge me for advance, and now my bill is 2x more amount and I am not sure if I can cover it since I always had enough money only for 1 month of invoice for each month, that's scummy and they just lost customer, they just put on debt collectors on people who couldn't pay for their invoices only cuz of their fault and I do not believe its legal at all, if anyone from Hetzner is reading my review, my ticket id is Ticket#2021030203062639 - I got threats to close my account too stating that my phone number is fake however its not at all Response to reply: my dedicated servers are few months old and I have 2 invoices of those dedicated servers, and support have said that it's for advance even head of sales said that, so reply doesn't make any sense to me. Hetzner is just charging people twice as much than it should even when customers paid for those dedicated servers for multiple times."
